{
  "artefact_id": "risk_register",
  "schema_version": "1.0.0",
  "publication_id": "fe3ace7c-a2c5-5ced-aa98-529590aa33b9",
  "published_at_utc": "2026-05-11T17:30:00Z",
  "published_by": "spec-037-implementer",
  "metadata": {
    "manual_row_count": 21,
    "total_row_count": 21,
    "manual_row_ratio": 1.0,
    "manual_row_ratio_threshold": 0.5,
    "link_check_status": "passed",
    "last_gate_run_utc": "2026-05-11T17:30:00Z",
    "auditor_signoff": {
      "name": "Capstone Evidence Pack v1 Author",
      "role": "Spec-037 Implementer",
      "signoff_date_utc": "2026-05-11T17:30:00Z",
      "basis": "AIDR M&E Framework + ISO/IEC 42001 §6.1 risk-acceptance pattern (analyser finding I5 + spec-037 FR-038)"
    }
  },
  "rows": [
    {
      "id": "RISK-AOAI-001",
      "title": "AI Model Unavailability During Disaster Operations",
      "category": "AI",
      "description": "Azure OpenAI outages during peak disaster load degrade agent output quality.",
      "likelihood": 3,
      "consequence": 4,
      "inherent_score": 12,
      "treatment": "Template fallback for all 5 agents; circuit breaker (3-failure / 30s); manual failover to AU Southeast; confidence threshold 0.7.",
      "owner": "Platform Operations Lead",
      "residual_likelihood": 2,
      "residual_consequence": 2,
      "residual_score": 4,
      "next_review_date": "2026-08-11",
      "back_citations": [
        {
          "kind": "spec",
          "ref": "specs/014-azure-openai-integration/spec.md"
        },
        {
          "kind": "governance_hub",
          "ref": "docs/risk-register/RISK-AOAI-001.md"
        }
      ],
      "provenance": {
        "tag": "manual",
        "source": "spec-037 author review",
        "owner": "Platform Operations Lead",
        "review_cadence": "quarterly",
        "automation_target": "spec-030 evaluation framework",
        "evidence_status": "Validated"
      }
    },
    {
      "id": "RISK-AOAI-002",
      "title": "Token Quota Exhaustion Under Sustained Disaster Load",
      "category": "AI",
      "description": "Concurrent multi-agent usage during prolonged disaster causes HTTP 429 throttling.",
      "likelihood": 2,
      "consequence": 3,
      "inherent_score": 6,
      "treatment": "Per-agent monthly budget tracking; two-tier model routing; tenacity retry with backoff.",
      "owner": "Platform Operations Lead",
      "residual_likelihood": 1,
      "residual_consequence": 2,
      "residual_score": 2,
      "next_review_date": "2026-06-11",
      "back_citations": [
        {
          "kind": "spec",
          "ref": "specs/014-azure-openai-integration/spec.md"
        }
      ],
      "provenance": {
        "tag": "manual",
        "source": "spec-037 author review",
        "owner": "Platform Operations Lead",
        "review_cadence": "quarterly",
        "automation_target": "spec-030 evaluation framework",
        "evidence_status": "Validated"
      }
    },
    {
      "id": "RISK-AOAI-003",
      "title": "Managed Identity Credential Propagation Delays",
      "category": "Operational",
      "description": "Entra ID role assignment propagation can take up to 10 minutes during deployments.",
      "likelihood": 1,
      "consequence": 3,
      "inherent_score": 3,
      "treatment": "Graceful degradation to template fallback; Bicep RBAC dependsOn sequencing; pre-traffic health checks.",
      "owner": "Platform Operations Lead",
      "residual_likelihood": 1,
      "residual_consequence": 2,
      "residual_score": 2,
      "next_review_date": "2026-08-11",
      "back_citations": [
        {
          "kind": "spec",
          "ref": "specs/014-azure-openai-integration/spec.md"
        }
      ],
      "provenance": {
        "tag": "manual",
        "source": "spec-037 author review",
        "owner": "Platform Operations Lead",
        "review_cadence": "quarterly",
        "automation_target": "spec-030 evaluation framework",
        "evidence_status": "Validated"
      }
    },
    {
      "id": "RISK-NEW-001",
      "title": "Container Apps revision saturation",
      "category": "Platform",
      "description": "Concurrent disaster activations could exceed Container Apps autoscale ceiling.",
      "likelihood": 3,
      "consequence": 4,
      "inherent_score": 12,
      "treatment": "HPA tuned in infra/main.bicep; load tests in tests/load/; KEDA scale-to-zero rejected for hot-path.",
      "owner": "Infrastructure/DevOps Lead",
      "residual_likelihood": 2,
      "residual_consequence": 3,
      "residual_score": 6,
      "next_review_date": "2026-08-11",
      "back_citations": [
        {
          "kind": "spec",
          "ref": "specs/032-rubric-improvements/spec.md"
        },
        {
          "kind": "agent_md",
          "ref": ".github/agents/technical/sre-engineer.agent.md"
        }
      ],
      "provenance": {
        "tag": "manual",
        "source": "spec-037 author review",
        "owner": "Infrastructure/DevOps Lead",
        "review_cadence": "quarterly",
        "automation_target": "spec-030 evaluation framework",
        "evidence_status": "Validated"
      }
    },
    {
      "id": "RISK-NEW-002",
      "title": "Cosmos partition hotspot under cross-jurisdiction surge",
      "category": "Platform",
      "description": "A multi-jurisdiction incident may concentrate writes on a single partition (audit-timeline /tenant_id).",
      "likelihood": 2,
      "consequence": 4,
      "inherent_score": 8,
      "treatment": "Partitioning math documented in docs/architecture/cosmos-partitioning.md; autoscale 1000 RU/s; capacity model in docs/governance-hub/architecture/capacity-model.md.",
      "owner": "Data Engineer",
      "residual_likelihood": 1,
      "residual_consequence": 3,
      "residual_score": 3,
      "next_review_date": "2026-08-11",
      "back_citations": [
        {
          "kind": "governance_hub",
          "ref": "docs/governance-hub/architecture/cosmos-partitioning.md"
        },
        {
          "kind": "agent_md",
          "ref": ".github/agents/technical/data-engineer.agent.md"
        }
      ],
      "provenance": {
        "tag": "manual",
        "source": "spec-037 author review",
        "owner": "Data Engineer",
        "review_cadence": "quarterly",
        "automation_target": "spec-030 evaluation framework",
        "evidence_status": "Validated"
      }
    },
    {
      "id": "RISK-NEW-003",
      "title": "Foundry RAG carve-out endpoint unavailability",
      "category": "Platform",
      "description": "Foundry inference endpoint outage breaks RAG-grounded sub-agent responses.",
      "likelihood": 2,
      "consequence": 3,
      "inherent_score": 6,
      "treatment": "Fallback to non-RAG path with explicit `rag_used:false` flag; spec-036 FR-RAG-LS-02 offline-cache bundles for Field Coordinator; chaos drill quarterly.",
      "owner": "Solution Architect",
      "residual_likelihood": 1,
      "residual_consequence": 3,
      "residual_score": 3,
      "next_review_date": "2026-08-11",
      "back_citations": [
        {
          "kind": "spec",
          "ref": "specs/036-foundry-rag-grounding/spec.md"
        },
        {
          "kind": "governance_hub",
          "ref": "infra/parameters/foundry-carveout.yaml"
        },
        {
          "kind": "adr",
          "ref": "docs/aidr/decisions/adr-033-phi-shadow-boundary.md"
        }
      ],
      "provenance": {
        "tag": "manual",
        "source": "spec-037 author review",
        "owner": "Solution Architect",
        "review_cadence": "quarterly",
        "automation_target": "spec-030 evaluation framework",
        "evidence_status": "Validated"
      }
    },
    {
      "id": "RISK-NEW-004",
      "title": "LLM hallucination in Communication Agent public alerts",
      "category": "AI",
      "description": "A grounded but hallucinated alert text could be approved if the human-in-the-loop fails.",
      "likelihood": 3,
      "consequence": 5,
      "inherent_score": 15,
      "treatment": "spec-008 FR-072 NN-1 mandatory PIO approval; spec-030 grounding-faithfulness eval gate; misinformation watchlist.",
      "owner": "Public Information Officer",
      "residual_likelihood": 1,
      "residual_consequence": 4,
      "residual_score": 4,
      "next_review_date": "2026-06-11",
      "back_citations": [
        {
          "kind": "spec",
          "ref": "specs/008-communication-agent/spec.md"
        },
        {
          "kind": "spec",
          "ref": "specs/030-llm-eval-framework/spec.md"
        }
      ],
      "provenance": {
        "tag": "manual",
        "source": "spec-037 author review",
        "owner": "Public Information Officer",
        "review_cadence": "quarterly",
        "automation_target": "spec-030 evaluation framework",
        "evidence_status": "Validated"
      }
    },
    {
      "id": "RISK-NEW-005",
      "title": "Sim-agent idempotency replay under simulated disaster load",
      "category": "AI",
      "description": "spec-036-sim-agent-extend telemetry-injection agent could double-fire under retries if idempotency cache fails.",
      "likelihood": 2,
      "consequence": 3,
      "inherent_score": 6,
      "treatment": "spec-036 ADR-036-009 idempotency-cache design (24h TTL); production-grade idempotency on /inject-telemetry per spec-036-sim-agent-extend FR-066; integration test in tests/integration/spec_036/.",
      "owner": "AI/ML Engineer",
      "residual_likelihood": 1,
      "residual_consequence": 2,
      "residual_score": 2,
      "next_review_date": "2026-08-11",
      "back_citations": [
        {
          "kind": "spec",
          "ref": "specs/036-sim-agent-extend/spec.md"
        },
        {